{
 "dialect": "informix-4gl/progress-abl",
 "edges": [
  {
   "from": "src/AF009_pgmas/EXCB005.4gl",
   "refs": [
    {
     "file": "src/AF009_pgmas/EXCB005.4gl",
     "line": 107
    },
    {
     "file": "src/AF009_pgmas/EXCB005.4gl",
     "line": 124
    },
    {
     "file": "src/AF009_pgmas/EXCB005.4gl",
     "line": 138
    },
    {
     "file": "src/AF009_pgmas/EXCB005.4gl",
     "line": 146
    },
    {
     "file": "src/AF009_pgmas/EXCB005.4gl",
     "line": 159
    },
    {
     "file": "src/AF009_pgmas/EXCB005.4gl",
     "line": 174
    },
    {
     "file": "src/AF009_pgmas/EXCB005.4gl",
     "line": 189
    },
    {
     "file": "src/AF009_pgmas/EXCB005.4gl",
     "line": 202
    },
    {
     "file": "src/AF009_pgmas/EXCB005.4gl",
     "line": 225
    },
    {
     "file": "src/AF009_pgmas/EXCB005.4gl",
     "line": 234
    },
    {
     "file": "src/AF009_pgmas/EXCB005.4gl",
     "line": 252
    },
    {
     "file": "src/AF009_pgmas/EXCB005.4gl",
     "line": 338
    },
    {
     "file": "src/AF009_pgmas/EXCB005.4gl",
     "line": 437
    },
    {
     "file": "src/AF009_pgmas/EXCB005.4gl",
     "line": 439
    },
    {
     "file": "src/AF009_pgmas/EXCB005.4gl",
     "line": 537
    }
   ],
   "to": "src/AF009_pgmas/EXCB001.4gl"
  },
  {
   "from": "src/AF009_pgmas/EXCB007.4gl",
   "refs": [
    {
     "file": "src/AF009_pgmas/EXCB007.4gl",
     "line": 106
    },
    {
     "file": "src/AF009_pgmas/EXCB007.4gl",
     "line": 120
    },
    {
     "file": "src/AF009_pgmas/EXCB007.4gl",
     "line": 123
    },
    {
     "file": "src/AF009_pgmas/EXCB007.4gl",
     "line": 126
    },
    {
     "file": "src/AF009_pgmas/EXCB007.4gl",
     "line": 137
    },
    {
     "file": "src/AF009_pgmas/EXCB007.4gl",
     "line": 150
    },
    {
     "file": "src/AF009_pgmas/EXCB007.4gl",
     "line": 167
    },
    {
     "file": "src/AF009_pgmas/EXCB007.4gl",
     "line": 174
    },
    {
     "file": "src/AF009_pgmas/EXCB007.4gl",
     "line": 192
    },
    {
     "file": "src/AF009_pgmas/EXCB007.4gl",
     "line": 199
    },
    {
     "file": "src/AF009_pgmas/EXCB007.4gl",
     "line": 296
    },
    {
     "file": "src/AF009_pgmas/EXCB007.4gl",
     "line": 395
    },
    {
     "file": "src/AF009_pgmas/EXCB007.4gl",
     "line": 397
    },
    {
     "file": "src/AF009_pgmas/EXCB007.4gl",
     "line": 495
    }
   ],
   "to": "src/AF009_pgmas/EXCB001.4gl"
  },
  {
   "from": "src/AF009_pgmas/EXCB007.4gl",
   "refs": [
    {
     "file": "src/AF009_pgmas/EXCB007.4gl",
     "line": 187
    }
   ],
   "to": "src/AF009_pgmas/EXCB005.4gl"
  },
  {
   "from": "src/AF009_pgmas/EXCB100.4gl",
   "refs": [
    {
     "file": "src/AF009_pgmas/EXCB100.4gl",
     "line": 95
    },
    {
     "file": "src/AF009_pgmas/EXCB100.4gl",
     "line": 97
    },
    {
     "file": "src/AF009_pgmas/EXCB100.4gl",
     "line": 114
    },
    {
     "file": "src/AF009_pgmas/EXCB100.4gl",
     "line": 540
    },
    {
     "file": "src/AF009_pgmas/EXCB100.4gl",
     "line": 542
    },
    {
     "file": "src/AF009_pgmas/EXCB100.4gl",
     "line": 640
    }
   ],
   "to": "src/AF009_pgmas/EXCB001.4gl"
  },
  {
   "from": "src/AF009_pgmas/EXCB102.4gl",
   "refs": [
    {
     "file": "src/AF009_pgmas/EXCB102.4gl",
     "line": 147
    },
    {
     "file": "src/AF009_pgmas/EXCB102.4gl",
     "line": 149
    },
    {
     "file": "src/AF009_pgmas/EXCB102.4gl",
     "line": 160
    },
    {
     "file": "src/AF009_pgmas/EXCB102.4gl",
     "line": 1470
    },
    {
     "file": "src/AF009_pgmas/EXCB102.4gl",
     "line": 1472
    },
    {
     "file": "src/AF009_pgmas/EXCB102.4gl",
     "line": 1570
    }
   ],
   "to": "src/AF009_pgmas/EXCB001.4gl"
  },
  {
   "from": "src/AF009_pgmas/EXCB102.4gl",
   "refs": [
    {
     "file": "src/AF009_pgmas/EXCB102.4gl",
     "line": 153
    },
    {
     "file": "src/AF009_pgmas/EXCB102.4gl",
     "line": 239
    }
   ],
   "to": "src/AF009_pgmas/EXCB100.4gl"
  },
  {
   "from": "src/AF009_pgmas/EXCB102.4gl",
   "refs": [
    {
     "file": "src/AF009_pgmas/EXCB102.4gl",
     "line": 267
    }
   ],
   "to": "src/AF009_pgmas/EXCB136.4gl"
  },
  {
   "from": "src/AF009_pgmas/EXCB103.4gl",
   "refs": [
    {
     "file": "src/AF009_pgmas/EXCB103.4gl",
     "line": 128
    },
    {
     "file": "src/AF009_pgmas/EXCB103.4gl",
     "line": 132
    },
    {
     "file": "src/AF009_pgmas/EXCB103.4gl",
     "line": 143
    },
    {
     "file": "src/AF009_pgmas/EXCB103.4gl",
     "line": 1475
    },
    {
     "file": "src/AF009_pgmas/EXCB103.4gl",
     "line": 1477
    },
    {
     "file": "src/AF009_pgmas/EXCB103.4gl",
     "line": 1575
    }
   ],
   "to": "src/AF009_pgmas/EXCB001.4gl"
  },
  {
   "from": "src/AF009_pgmas/EXCB103.4gl",
   "refs": [
    {
     "file": "src/AF009_pgmas/EXCB103.4gl",
     "line": 137
    }
   ],
   "to": "src/AF009_pgmas/EXCB100.4gl"
  },
  {
   "from": "src/AF009_pgmas/EXCB103.4gl",
   "refs": [
    {
     "file": "src/AF009_pgmas/EXCB103.4gl",
     "line": 134
    },
    {
     "file": "src/AF009_pgmas/EXCB103.4gl",
     "line": 135
    },
    {
     "file": "src/AF009_pgmas/EXCB103.4gl",
     "line": 136
    },
    {
     "file": "src/AF009_pgmas/EXCB103.4gl",
     "line": 287
    }
   ],
   "to": "src/AF009_pgmas/EXCB102.4gl"
  },
  {
   "from": "src/AF009_pgmas/EXCB103.4gl",
   "refs": [
    {
     "file": "src/AF009_pgmas/EXCB103.4gl",
     "line": 215
    },
    {
     "file": "src/AF009_pgmas/EXCB103.4gl",
     "line": 218
    }
   ],
   "to": "src/AF009_pgmas/EXCB136.4gl"
  },
  {
   "from": "src/AF009_pgmas/EXCB106.4gl",
   "refs": [
    {
     "file": "src/AF009_pgmas/EXCB106.4gl",
     "line": 115
    },
    {
     "file": "src/AF009_pgmas/EXCB106.4gl",
     "line": 120
    },
    {
     "file": "src/AF009_pgmas/EXCB106.4gl",
     "line": 133
    },
    {
     "file": "src/AF009_pgmas/EXCB106.4gl",
     "line": 771
    },
    {
     "file": "src/AF009_pgmas/EXCB106.4gl",
     "line": 773
    },
    {
     "file": "src/AF009_pgmas/EXCB106.4gl",
     "line": 871
    }
   ],
   "to": "src/AF009_pgmas/EXCB001.4gl"
  },
  {
   "from": "src/AF009_pgmas/EXCB106.4gl",
   "refs": [
    {
     "file": "src/AF009_pgmas/EXCB106.4gl",
     "line": 122
    },
    {
     "file": "src/AF009_pgmas/EXCB106.4gl",
     "line": 125
    },
    {
     "file": "src/AF009_pgmas/EXCB106.4gl",
     "line": 127
    }
   ],
   "to": "src/AF009_pgmas/EXCB100.4gl"
  },
  {
   "from": "src/AF009_pgmas/EXCB106.4gl",
   "refs": [
    {
     "file": "src/AF009_pgmas/EXCB106.4gl",
     "line": 123
    },
    {
     "file": "src/AF009_pgmas/EXCB106.4gl",
     "line": 172
    },
    {
     "file": "src/AF009_pgmas/EXCB106.4gl",
     "line": 178
    },
    {
     "file": "src/AF009_pgmas/EXCB106.4gl",
     "line": 362
    },
    {
     "file": "src/AF009_pgmas/EXCB106.4gl",
     "line": 445
    },
    {
     "file": "src/AF009_pgmas/EXCB106.4gl",
     "line": 467
    }
   ],
   "to": "src/AF009_pgmas/EXCB102.4gl"
  },
  {
   "from": "src/AF009_pgmas/EXCB106.4gl",
   "refs": [
    {
     "file": "src/AF009_pgmas/EXCB106.4gl",
     "line": 170
    },
    {
     "file": "src/AF009_pgmas/EXCB106.4gl",
     "line": 256
    }
   ],
   "to": "src/AF009_pgmas/EXCB136.4gl"
  },
  {
   "from": "src/AF009_pgmas/EXCC001.4gl",
   "refs": [
    {
     "file": "src/AF009_pgmas/EXCC001.4gl",
     "line": 101
    },
    {
     "file": "src/AF009_pgmas/EXCC001.4gl",
     "line": 113
    },
    {
     "file": "src/AF009_pgmas/EXCC001.4gl",
     "line": 127
    },
    {
     "file": "src/AF009_pgmas/EXCC001.4gl",
     "line": 132
    },
    {
     "file": "src/AF009_pgmas/EXCC001.4gl",
     "line": 164
    },
    {
     "file": "src/AF009_pgmas/EXCC001.4gl",
     "line": 169
    },
    {
     "file": "src/AF009_pgmas/EXCC001.4gl",
     "line": 219
    },
    {
     "file": "src/AF009_pgmas/EXCC001.4gl",
     "line": 223
    },
    {
     "file": "src/AF009_pgmas/EXCC001.4gl",
     "line": 227
    },
    {
     "file": "src/AF009_pgmas/EXCC001.4gl",
     "line": 231
    },
    {
     "file": "src/AF009_pgmas/EXCC001.4gl",
     "line": 236
    },
    {
     "file": "src/AF009_pgmas/EXCC001.4gl",
     "line": 241
    },
    {
     "file": "src/AF009_pgmas/EXCC001.4gl",
     "line": 457
    },
    {
     "file": "src/AF009_pgmas/EXCC001.4gl",
     "line": 459
    },
    {
     "file": "src/AF009_pgmas/EXCC001.4gl",
     "line": 549
    }
   ],
   "to": "src/AF009_pgmas/EXCB001.4gl"
  },
  {
   "from": "src/AF009_pgmas/EXCC001.4gl",
   "refs": [
    {
     "file": "src/AF009_pgmas/EXCC001.4gl",
     "line": 205
    },
    {
     "file": "src/AF009_pgmas/EXCC001.4gl",
     "line": 258
    },
    {
     "file": "src/AF009_pgmas/EXCC001.4gl",
     "line": 270
    },
    {
     "file": "src/AF009_pgmas/EXCC001.4gl",
     "line": 282
    },
    {
     "file": "src/AF009_pgmas/EXCC001.4gl",
     "line": 294
    }
   ],
   "to": "src/AF009_pgmas/EXCB100.4gl"
  },
  {
   "from": "src/AF009_pgmas/EXCC001.4gl",
   "refs": [
    {
     "file": "src/AF009_pgmas/EXCC001.4gl",
     "line": 94
    },
    {
     "file": "src/AF009_pgmas/EXCC001.4gl",
     "line": 95
    }
   ],
   "to": "src/AF009_pgmas/EXCB102.4gl"
  }
 ],
 "nodes": [
  {
   "functions": 7,
   "name": "src/AF009_pgmas/EXCB001.4gl"
  },
  {
   "functions": 6,
   "name": "src/AF009_pgmas/EXCB005.4gl"
  },
  {
   "functions": 6,
   "name": "src/AF009_pgmas/EXCB007.4gl"
  },
  {
   "functions": 9,
   "name": "src/AF009_pgmas/EXCB100.4gl"
  },
  {
   "functions": 22,
   "name": "src/AF009_pgmas/EXCB102.4gl"
  },
  {
   "functions": 22,
   "name": "src/AF009_pgmas/EXCB103.4gl"
  },
  {
   "functions": 13,
   "name": "src/AF009_pgmas/EXCB106.4gl"
  },
  {
   "functions": 12,
   "name": "src/AF009_pgmas/EXCB136.4gl"
  },
  {
   "functions": 14,
   "name": "src/AF009_pgmas/EXCC001.4gl"
  }
 ],
 "stats": {
  "edges": 18,
  "functions_defined": 69,
  "most_called": [
   {
    "callers": 7,
    "module": "src/AF009_pgmas/EXCB001.4gl"
   },
   {
    "callers": 4,